{
  "event_type": "new_order",
  "order_id": "D-12345",
  "store_id": "D-12345",
  "status": "active",
  "subtotal": 42,
  "tax": 42,
  "tip": 42,
  "items": [
    {
      "id": "D-12345",
      "name": "Acme Pickup Store",
      "quantity": 1,
      "price": 42,
      "special_instructions": "Leave at the front desk.",
      "options": [
        {}
      ]
    }
  ],
  "customer": {
    "first_name": "Acme Pickup Store",
    "last_name": "Acme Pickup Store",
    "phone_number": "+15555551234"
  },
  "delivery_address": "901 Market St, San Francisco, CA 94105",
  "special_instructions": "Leave at the front desk.",
  "estimated_pickup_time": "2026-06-02T14:30:00Z",
  "created_at": "2026-06-02T14:30:00Z"
}
